{
  "schema_version": "0.1.0",
  "kind": "source-review",
  "review_id": "SOURCE-REVIEW-mingos-unified-archive-2026-08-06-3",
  "space_id": "mingos-project",
  "conflict_report_id": "CONFLICT-REPORT-mingos-unified-archive-2026-08-06",
  "conflict_id": "CONFLICT-mingos-canonical-entrypoint",
  "candidate_value_refs": [
    "VALUE-mingos-canonical-entrypoint-1",
    "VALUE-mingos-canonical-entrypoint-2"
  ],
  "created_by_actor_id": "agent-continuity",
  "reviewer_actor_id": "human-yueming",
  "review_status": "submitted",
  "decision": "accept-value",
  "selected_value_ref": "VALUE-mingos-canonical-entrypoint-2",
  "rationale": "月明接受 YuemingHub/MingOS 为当前 MingOS 规范入口仓；YuemingHub/mingos-unified 仅保留为历史来源，不作为当前规范入口。",
  "supporting_refs": [
    "github:YuemingHub/MingOS@979a0e32f1e4c760f7e339f4b503bba44edfbbb0/README.md"
  ],
  "requested_evidence": [],
  "revocable": true,
  "decided_at": "2026-08-06T15:51:07Z",
  "revoked_at": null,
  "revocation_reason": null,
  "supersedes_review_id": null,
  "created_at": "2026-08-06T14:50:00Z",
  "updated_at": "2026-08-07T02:07:00Z"
}
